{
  "format": "reactorsim.reference-raw-run/v1",
  "approval_status": "unapproved_schema_example",
  "case": {
    "case_id": "donjon5-afa-180-310-type1-dual-v5.1.0",
    "descriptor_path": "reference/donjon5/P1-T03-AFA_180_310_type1_dual.case.json",
    "descriptor_sha256": "09851b1ee3155592eaa379454f2baa615af3749f82507bbb4ad526f0282a881b"
  },
  "tool": {
    "program": "donjon5",
    "version": "5.1.0",
    "source_commit": "eee582f8594d3b7d01b65660ca1e8bef00eb6b2a",
    "source_tree": "0d3e8f721c84b3c3b2d03e9898a8a0a9c29287d8",
    "executable_sha256": "e125c8bc095d9a1a7e088847b1c21b1bc37043681b6104713fa29ee1507f1a76",
    "container_image_digest": "sha256:eb8ddff7d788f563f958ada277a2c8304d2dcf829ef59a35db62438397188d79"
  },
  "execution": {
    "runner_path": "tools/PhysicsData/Run-P1-T03-DonjonAfa180310.ps1",
    "runner_sha256": "e63424d40d60074b4851244d1d93d4c944cf309c864da9a72d99ac457e815913",
    "started_utc": "2026-08-07T12:02:00Z",
    "finished_utc": "2026-08-07T12:03:00Z",
    "invocation_id": "schema-example-donjon5",
    "network_mode": "none"
  },
  "artifacts": [
    {
      "artifact_id": "raw-listing",
      "role": "listing",
      "media_type": "text/plain",
      "byte_length": 23456,
      "sha256": "bbbbbbbbbbbbbbbbbbbbbbbbbbbbbbbbbbbbbbbbbbbbbbbbbbbbbbbbbbbbbbbb",
      "retention": "external-private",
      "publication": "not-approved",
      "locator_id": "opaque:schema-example-donjon5-listing"
    },
    {
      "artifact_id": "program-stderr",
      "role": "stderr",
      "media_type": "text/plain",
      "byte_length": 0,
      "sha256": "e3b0c44298fc1c149afbf4c8996fb92427ae41e4649b934ca495991b7852b855",
      "retention": "external-private",
      "publication": "not-approved",
      "locator_id": "opaque:schema-example-donjon5-stderr"
    }
  ],
  "outcome": {
    "status": "succeeded",
    "normal_end": true,
    "warning_codes": [
      {
        "code": "donjon5.sphapx.media_volume_missing",
        "count": 2
      }
    ],
    "error_codes": [],
    "assertions": [
      {
        "assertion_id": "donjon5.AFA_180_310_type1_dual.k_effective",
        "passed": true,
        "count": 1,
        "observed": {
          "quantity_id": "donjon5.assertion.delta",
          "value": 5.968865e-8,
          "source_lexeme": "5.968865E-08"
        }
      }
    ],
    "convergence": {
      "status": "converged",
      "measures": [
        {
          "quantity_id": "donjon5.flddir.outer_iteration",
          "value": 15,
          "source_lexeme": "15"
        },
        {
          "quantity_id": "donjon5.flddir.dels",
          "value": 5.5e-08,
          "source_lexeme": "0.55E-07"
        },
        {
          "quantity_id": "donjon5.flddir.delt",
          "value": 0.000082,
          "source_lexeme": "0.82E-04"
        },
        {
          "quantity_id": "donjon5.flddir.epsout",
          "value": 0.0001,
          "source_lexeme": "1.00E-04"
        }
      ]
    }
  }
}
