{
  "format": "reactorsim.reference-raw-run/v1",
  "approval_status": "unapproved_schema_example",
  "case": {
    "case_id": "dragon5-lumpss-v5.1.0-source-era",
    "descriptor_path": "reference/dragon5/P1-T02-lumpSS.case.json",
    "descriptor_sha256": "ce053458cbd18987a9ca81dd15a088b0d64b36eebded23395bf928786ee399ae"
  },
  "tool": {
    "program": "dragon5",
    "version": "5.1.0",
    "source_commit": "eee582f8594d3b7d01b65660ca1e8bef00eb6b2a",
    "source_tree": "0d3e8f721c84b3c3b2d03e9898a8a0a9c29287d8",
    "executable_sha256": "3121023a186cab6d0a56fd363bb979794fcd904f860f49439567bff4b1510cd0",
    "container_image_digest": "sha256:eb8ddff7d788f563f958ada277a2c8304d2dcf829ef59a35db62438397188d79"
  },
  "execution": {
    "runner_path": "tools/PhysicsData/Run-P1-T02-DragonLumpSS.ps1",
    "runner_sha256": "2beff1a47430ed3cd7ba89e4726f3fac13b6fcd42509cfaa1e105ed1e3abd928",
    "started_utc": "2026-08-07T12:00:00Z",
    "finished_utc": "2026-08-07T12:01:00Z",
    "invocation_id": "schema-example-dragon5",
    "network_mode": "none"
  },
  "artifacts": [
    {
      "artifact_id": "raw-listing",
      "role": "listing",
      "media_type": "text/plain",
      "byte_length": 12345,
      "sha256": "aaaaaaaaaaaaaaaaaaaaaaaaaaaaaaaaaaaaaaaaaaaaaaaaaaaaaaaaaaaaaaaa",
      "retention": "external-private",
      "publication": "not-approved",
      "locator_id": "opaque:schema-example-dragon5-listing"
    },
    {
      "artifact_id": "program-stderr",
      "role": "stderr",
      "media_type": "text/plain",
      "byte_length": 96,
      "sha256": "cde5e7d17e64813704a51a756095eaf585d28601c664fa68a1f27038b6399fcc",
      "retention": "external-private",
      "publication": "not-approved",
      "locator_id": "opaque:schema-example-dragon5-stderr"
    }
  ],
  "outcome": {
    "status": "succeeded",
    "normal_end": true,
    "warning_codes": [],
    "error_codes": [],
    "assertions": [
      {
        "assertion_id": "dragon5.lumpSS.upstream_assertions",
        "passed": true,
        "count": 3
      }
    ],
    "convergence": {
      "status": "converged",
      "measures": [
        {
          "quantity_id": "dragon5.lumpSS.final_external_convergence_count",
          "value": 3,
          "source_lexeme": "3"
        }
      ]
    }
  }
}
